{
  "$schema": "https://json-schema.org/draft-07/schema#",
  "$id": "https://json-schema.org/draft-07/schema",
  "title": "Cosmos Wallet",
  "description": "Cosmos Wallet.json is a metadata file that contains information about a wallet of a specific platform and which chains it supports, either natively or via custom client-side addition.",
  "type": "object",
  "properties": {
    "$schema": {
      "type": "string"
    },
    "wallet_name": {
      "type": "string",
      "pattern": "[a-z]+"
    },
    "pretty_name": {
      "type": "string"
    },
    "website": {
      "type": "string",
      "format": "url"
    },
    "git_repo": {
      "type": "string",
      "format": "url"
    },
    "supported_chains": {
      "type": "array",
      "items": {
        "type": "string",
        "pattern": "[a-z0-9]+"
      },
      "minContains": 1
    },
    "features": {
      "type": "array",
      "items": {
        "type": "string",
        "enum": ["suggest_chain", "get_supported_chains", "icns"]
      }
    },
    "platforms": {
      "type": "array",
      "items": {
        "type": "object",
        "properties": {
          "device": {
            "type": "string",
            "enum": ["mobile", "tablet", "desktop", "other"]
          },
          "type": {
            "type": "string",
            "enum": ["application", "extension"]
          },
          "platform": {
            "type": "string",
            "enum": [
              "chrome",
              "firefox",
              "ios",
              "android",
              "otherOS",
              "otherBrowser"
            ]
          },
          "install_link": {
            "type": "string",
            "format": "uri"
          }
        },
        "additionalProperties": false,
        "required": ["device", "type", "platform"]
      },
      "minContains": 1
    },
    "images": {
      "type": "array",
      "items": {
        "type": "object",
        "properties": {
          "png": {
            "type": "string",
            "format": "uri-reference",
            "pattern": "^https://raw\\.githubusercontent\\.com/cosmos/wallet-registry/main/(.*)\\.png$"
          },
          "svg": {
            "type": "string",
            "format": "uri-reference",
            "pattern": "^https://raw\\.githubusercontent\\.com/cosmos/wallet-registry/main/(.*)\\.svg$"
          },
          "theme": {
            "type": "object",
            "properties": {
              "primary_color_hex": {
                "type": "string",
                "pattern": "^#[0-9a-fA-F]{6}$"
              },
              "circle": {
                "type": "boolean"
              },
              "dark_mode": {
                "type": "boolean"
              }
            },
            "minProperties": 1,
            "additionalProperties": false
          },
          "layout": {
            "type": "string",
            "enum": ["logo", "logomark", "logotype"],
            "description": "logomark == icon only; logotype == text only; logo == icon + text."
          },
          "text_position": {
            "type": "string",
            "enum": ["top", "bottom", "left", "right", "integrated"],
            "description": "Indicates in which position the text is placed, in case the layout is 'icon' type, it's required only in this case."
          }
        },
        "if": {
          "properties": {
            "layout": { "const": "logo" }
          },
          "required": ["layout"]
        },
        "then": {
          "required": ["text_position"]
        },
        "anyOf": [
          {
            "required": ["png"]
          },
          {
            "required": ["svg"]
          }
        ],
        "required": ["layout"],
        "additionalProperties": false
      }
    },
    "wallet_connect": {
      "type": "object",
      "properties": {
        "deeplink": {
          "type": "object",
          "description": "define all the properties related to deeplink functionality.",
          "properties": {
            "path": {
              "type": "object",
              "description": "it is the path of the deelink URL that will trigger wallet connect actions within a mobile wallet.",
              "properties": {
                "ios": {
                  "type": "string"
                },
                "android": {
                  "type": "string"
                },
                "universal": {
                  "type": "string"
                }
              }
            }
          }
        }
      }
    },
    "mobile": {
      "type": "object",
      "properties": {
        "android": {
          "type": "object",
          "properties": {
            "packageName": {
              "type": "string",
              "description": "The package name for your Android standalone app. You make it up, but it needs to be unique on the Play Store. See this [StackOverflow question](https://stackoverflow.com/questions/6273892/android-package-name-convention)."
            },
            "schema": {
              "type": "string",
              "description": "Custom schema that provide a way to reference resources inside an app, documented [here](https://developer.android.com/training/app-links/deep-linking)."
            },
            "universalSchema": {
              "type": "string",
              "description": "Universal schema for universal deeplink that provide a way to reference resources inside an app, documented [here](https://developer.android.com/training/app-links)."
            }
          }
        },
        "ios": {
          "type": "object",
          "properties": {
            "bundleIdentifier": {
              "type": "string",
              "description": "The bundle identifier for your iOS standalone app. You make it up, but it needs to be unique on the App Store. See this [StackOverflow question](https://stackoverflow.com/questions/11347470/what-does-bundle-identifier-mean-in-an-ios-project)."
            },
            "schema": {
              "type": "string",
              "description": "Custom URL schemes provide a way to reference resources inside an app, documented [here](https://developer.apple.com/documentation/xcode/defining-a-custom-url-scheme-for-your-app)."
            },
            "universalSchema": {
              "type": "string",
              "description": "Universal schema for universal deeplink that provide a way to reference resources inside an app, documented [here](https://developer.apple.com/ios/universal-links/)."
            }
          }
        }
      }
    }
  },
  "additionalProperties": false,
  "required": [
    "$schema",
    "wallet_name",
    "pretty_name",
    "platforms",
    "supported_chains",
    "images"
  ]
}
